status,META_requiredChecksPassing,GEOM_requiredChecksPassing,META_canonicalNameInMeta,META_licenseImageInZip,META_yearValid,META_isoValid,META_boundaryTypeValid,META_sourceExists,META_releaseTypeValid,META_releaseTypeCorrectFolder,META_licenseValid,META_licenseSourceExists,META_dataSourceExists,GEOM_boundaryNamesColumnExists,GEOM_boundaryNamesFilledIn,GEOM_boundaryISOColumnExists,GEOM_boundaryISOsFilledIn,GEOM_Topology,GEOM_Projection,boundaryID,boundaryISO,boundaryType,boundaryYear,boundarySource_1,boundarySource_2,boundaryCanonical,boundaryLicense,licenseDetail,licenseSource,boundarySourceURL,downloadURL
PASS,True,True,False,False,True,True,True,True,True,True,True,True,True,True,True,False,False,True,True,NPL-ADM1-dev,NPL,ADM1,2017,Nepal Survey Department,United Nations Office for the Coordination of Humanitarian Affairs Regional Office for Asia and the Pacific (ROAP),,Other - Humanitarian,Humanitarian use only - Noted in metadata tab,https//data.humdata.org/dataset/administrative-bounadries-of-nepal,https//data.humdata.org/dataset/administrative-bounadries-of-nepal,https://github.com/wmgeolab/gbRelease/raw/master/releaseData/gbAuthoritative/NPL_ADM1.zip
PASS,True,True,False,False,True,True,True,True,True,True,True,True,True,True,True,False,False,True,True,NPL-ADM2-dev,NPL,ADM2,2017,Nepal Survey Department,United Nations Office for the Coordination of Humanitarian Affairs Regional Office for Asia and the Pacific (ROAP),,Other - Humanitarian,Humanitarian use only,https//data.humdata.org/dataset/administrative-bounadries-of-nepal,https//data.humdata.org/dataset/administrative-bounadries-of-nepal,https://github.com/wmgeolab/gbRelease/raw/master/releaseData/gbAuthoritative/NPL_ADM2.zip
PASS,True,True,True,True,True,True,True,True,True,True,True,True,True,True,True,False,False,False,True,MWI-ADM3-dev,MWI,ADM3,2008,OCHA,National Statistical Office of Malawi,Traditional Authority Area,Other - Humanitarian,Humanitarian use only - Noted in metadata tab,https//data.humdata.org/dataset/malawi-administrative-level-0-3-bounda             ries,https//data.humdata.org/dataset/malawi-administrative-level-0-3-boundaries,https://github.com/wmgeolab/gbRelease/raw/master/releaseData/gbAuthoritative/MWI_ADM3.zip
PASS,True,True,True,False,True,True,True,True,True,True,True,True,True,True,True,True,True,True,True,NPL-ADM0-dev,NPL,ADM0,2017,Nepal Survey Department,United Nations Office for the Coordination of Humanitarian Affairs Regional Office for Asia and the Pacific (ROAP),Country,Other - Humanitarian,Humanitarian use only - Noted in metadata tab,https//data.humdata.org/dataset/administrative-bounadries-of-nepal,https//data.humdata.org/dataset/administrative-bounadries-of-nepal,https://github.com/wmgeolab/gbRelease/raw/master/releaseData/gbAuthoritative/NPL_ADM0.zip
PASS,True,True,False,False,True,True,True,True,True,True,True,True,True,True,True,False,False,False,True,KGZ-ADM2-dev,KGZ,ADM2,2016,Ministry of Emergency Situations of the Kyrgyz Republic,nan,,Other - Humanitarian,Humanitarian use only - Noted in metadata tab,https//data.humdata.org/dataset/kyrgyzstan-administrative-boundaries,https//data.humdata.org/dataset/kyrgyzstan-administrative-boundaries,https://github.com/wmgeolab/gbRelease/raw/master/releaseData/gbAuthoritative/KGZ_ADM2.zip
PASS,True,True,False,False,True,True,True,True,True,True,True,True,True,True,True,False,False,False,True,LKA-ADM4-dev,LKA,ADM4,2017,"The Survey Department of Sri Lanka, National Building Research Organisation (NBRO), Disaster Management Centre (DMC)",United Nations Office for the Coordination of Humanitarian Affairs Regional Office for Asia and the Pacific (ROAP),,Other - Humanitarian,Humanitarian use only - Noted in metadata tab,https//data.humdata.org/about/license,https//data.humdata.org/dataset/sri-lanka-administrative-levels-0-4-boundaries,https://github.com/wmgeolab/gbRelease/raw/master/releaseData/gbAuthoritative/LKA_ADM4.zip
